{
  "kind": "cross_platform_capture_smoke",
  "non_claims": [
    "no transport requalification (final5 owns cdpkit selection)",
    "no host-speed percentile threshold (ack/cadence are diagnostics)",
    "no product-thesis capture-probability threshold",
    "no duration sweep, defect corpus, artifact comparison, or storage validation",
    "no chrome-acknowledgement-token continuity claim"
  ],
  "provenance": {
    "architecture": "aarch64",
    "browser_installation": {
      "discovered_version": "149.0.7827.201",
      "executable_source": "environment_override",
      "product": "chrome"
    },
    "capture_config": {
      "ack_timeout_ms": 250,
      "format": "jpeg",
      "gap_ledger_capacity": 64,
      "jpeg_quality": 80,
      "max_active_streams": 8,
      "max_base64_payload_bytes": 8388608,
      "max_dimensions": null,
      "queue_capacity": 4,
      "shutdown_timeout_ms": 5000
    },
    "cdpkit_version": "0.4.0",
    "configuration_name": "macos-chrome-default-dpi",
    "fixture": {
      "animation_js_sha256": "sha256:84ba666539a996012a781637c1a894d8c7a4789cfca84661bd7cf8b79efa2e13",
      "index_html_sha256": "sha256:9b42ae730d12a95772a946bf55e4838a5443b6cb4c536424570219041b6e2a68",
      "name": "cdp-transport-gate",
      "path": "tests/fixtures/browser/cdp-transport-gate"
    },
    "krometrail_revision": "4dfc78b2a6e91c3404fc58c3c8b98c5b6d662fdc",
    "launch": {
      "endpoint": "loopback",
      "force_device_scale_factor": 1.0,
      "ownership": "managed",
      "profile_kind": "temporary",
      "wrapper_variant": "default_dpi"
    },
    "platform": "macos",
    "runtime_version": {
      "js_version": "14.9.207.35",
      "product": "chrome",
      "product_version": "149.0.7827.201",
      "protocol_version": "1.3",
      "revision": "@6a7b3dbec3b2ca25877c2553b5473b2f277ef644",
      "user_agent": "Mozilla/5.0 (Macintosh; Intel Mac OS X 10_15_7) AppleWebKit/537.36 (KHTML, like Gecko) HeadlessChrome/149.0.0.0 Safari/537.36"
    },
    "rust_version": "rustc 1.97.0 (2d8144b78 2026-07-07)"
  },
  "schema_version": 1,
  "sessions": [
    {
      "ack_latency_nanos": {
        "max": 27557917,
        "p50": 524287,
        "p95": 16777215,
        "p99": 33554431,
        "samples": 30
      },
      "capture_config": {
        "ack_timeout_ms": 250,
        "format": "jpeg",
        "gap_ledger_capacity": 64,
        "jpeg_quality": 80,
        "max_active_streams": 8,
        "max_base64_payload_bytes": 8388608,
        "max_dimensions": null,
        "queue_capacity": 4,
        "shutdown_timeout_ms": 5000
      },
      "capture_ordinal_range": {
        "max": 30,
        "min": 1
      },
      "declared_gaps": [],
      "device_scale_factor": 1.0,
      "frame_cadence_nanos": {
        "max": 40601375,
        "p50": 16777215,
        "p95": 67108863,
        "p99": 67108863,
        "samples": 29
      },
      "frame_count": 30,
      "image_dimensions": {
        "height": 413,
        "width": 756
      },
      "name": "fidelity",
      "observed_clock_span_nanos": 436452875,
      "session_clock_span_nanos": 436452875,
      "source_time_samples": 30,
      "viewport": {
        "height": 413,
        "width": 756
      },
      "visibility_events": 0
    },
    {
      "ack_latency_nanos": {
        "max": 2601916,
        "p50": 1048575,
        "p95": 4194303,
        "p99": 4194303,
        "samples": 6
      },
      "capture_config": {
        "ack_timeout_ms": 250,
        "format": "jpeg",
        "gap_ledger_capacity": 64,
        "jpeg_quality": 80,
        "max_active_streams": 8,
        "max_base64_payload_bytes": 8388608,
        "max_dimensions": null,
        "queue_capacity": 1,
        "shutdown_timeout_ms": 5000
      },
      "capture_ordinal_range": {
        "max": 2,
        "min": 1
      },
      "declared_gaps": [
        {
          "count": 4,
          "reason": "ingestion_queue_saturated"
        }
      ],
      "device_scale_factor": 1.0,
      "frame_cadence_nanos": {
        "max": 18265834,
        "p50": 16777215,
        "p95": 33554431,
        "p99": 33554431,
        "samples": 5
      },
      "frame_count": 2,
      "image_dimensions": {
        "height": 413,
        "width": 756
      },
      "name": "loss_reporting",
      "observed_clock_span_nanos": 12315959,
      "session_clock_span_nanos": 12315959,
      "source_time_samples": 2,
      "viewport": {
        "height": 413,
        "width": 756
      },
      "visibility_events": 0
    }
  ],
  "shutdown": {
    "flush_count": 1,
    "outcome": "managed_browser_closed",
    "process_references_after": [],
    "profile_references_after": []
  }
}